id,sentence
valid_habiganj (6).wav,আগে দশ টাকা আছিল এখন বর্তমানে এতো জিনিসে তরুণ শেখ গযাচছে না ওইযা বর্তমানে পন্ডরো টেকা ি তারা একটা বেট খরছে পনরো টেকা দেওয়া লাগে শ্রমিক এরা বইয়া পন্ডো টেকা না ছারা পোসেন
valid_habiganj (7).wav,হুসেনা খুছ ওবজিদিসে দোন নামছি টেকার মূল্যত থেকি জিবিসে মন্দ বুষ্টি বুঝছি তাইলতে গরুর কাসা মানে বালোয় চলতাছেনা মোডামুদু আলহামদুলিল্লাহ বালোই চলতাছ
valid_habiganj (8).wav,ঈদের লইগা রাকসোসছন গরু মানে কুরবানুর বানি যে কোনো গরু হাতার না রোম জানের রোমজান ওইতো গরুর হার দায় নরা উর যা দো গরুর মাংসও হাটার মাংসে দিখি আমু আখন বুুবিসিবর খাটার মাংসোর লাগি নিবুর যা ইতো
valid_habiganj (9).wav,আর গাবিও আছে দুইটা আর খাতার মাংষোর লগে আনমো গাবিও আছে যে যেয় একটা পছন্দ খইরবের নে আমরা তো ব্যবসায়ী আমরা তোআর আমরা কাছে তর কাচা টাজানা
valid_habiganj (10).wav,ইয়েভাবে যা জাগাতো যেহেতো যে দৌরে দিতা মারি ধরে ছে আই  দো রুকতিরহ হওয়ার কথা হয় মুদ্দা মদ্দি ভালে ও রমজান মাস্ট না এখনশীত  লোকটি এখন বড়
valid_habiganj (11).wav,মুটামুটি তেমন বেশিওইকি নায় ঘ ন গরু বাজারতে যাও তোমরা মানে গরুরটে কিনে ব্যাচ হ এগলা কি দালাল টালা থাখে গরুর দালাল্লা অদাদালাসে দাদাে দেওয়া লাগে তোমার অনেক সময়
valid_habiganj (12).wav,হজারফন্ট দুই আজার দাড়াল দিয়া দিলে দালালে বেইচ্চা দে য়নাআইলে তোমার দায়াজ ছাড়া  দালালে তোব্বা কিতা দালায়ে দারো দেছো না দাঁলালে লুক লইয়া তোমরার যারো অনেক সময় দালালে গছ রসুন লাগে অনেক সময় দাঁলালে ঘিরোসলয়া সাতে ব অনেক সময় দরছে দালাল ছাড়া ও আমরার দাদায়য়
valid_habiganj (13).wav,জিরা চাইড়া ছবিক যদি হ ভচছে বাত
valid_habiganj (14).wav,কি অবস্তারে তানিম কিতা খরছ ভালোই আছে তুমি কিতা খরো বা বানানি ওয় তো আছি বালোই রোজা রমজানের দিন বৃষ্টি পাইদলা দিন বুইয়া তাকি গরো বাইর উনি যা না অখন কিতা খরোন আজকে তো দ্বিতীয় রমজান যায়  অখন তুমার নাম কিতা আমার নাম তানিম
valid_habiganj (15).wav,আইচ্ছা ফরিচয়টা বালা খইরা দেলা বয়সইয় শ্যাষের বিষয়  আমি আমার নাম তানিম আমি তাকি বগাডুগি গ্রামে আমার বয়স আঠারো বছর আইচ্ছা একুন ক্লাসে বড়ো বা তো এবার ইন্টাররে ফরতেছি আরকি  ফড়তাছে ইন্টারে ফড়ো না তো কিতা অবস্থা খেলা যাবা খরুরুনি বা দিনখালের কিতা অবস্থা একটু যদি আমরার খইতায়
valid_habiganj (16).wav,হয় এখন তো ইস্কুল প্রতিষ্ঠান সবকিছু কলেজ থেলি বন্ধ এই কারণে খেলা ধুলাও অয় দিকালে আইচ্ছা কুনানা খেলাত যাওউতেন ওই আমরার এলাখাতফাশে একটা আছে ডিগির ফাত মাঠ উট নাই আইচ্ছামা টেরো ভালো না আরকি  আগের কার মাইনষে তো মনো খরো আমরার বাপ তছাদাদা দা যেরা আছলো এরা তো বড় বড় মাঠে উনছি হেল্থ ও যাইতে ওইতো আমরা তো এলাখাত তা এখনে
valid_habiganj (17).wav,মুটামুটি সবওইয়ার মতো মাঠের সুবিধা ফাই না আর এখন কিন্তু আগের মতো খেলা অয় না আগে যেরখম সবাই খেলতো ইরখম কেউ এখন খেলে না এখন খেলার লাগি মানুষ তোকায় ফাওয়া যায় না সবাই মোবাইলের ফিছনের সময় নষ্ট খরে কেউরে মিলে না তুগাইয়া ওয় মোবাইল সুবাইল তারফরে মানুষ বিবিন্ন খাজকামে বিবিন্ন দিকের
valid_habiganj (18).wav,মানুষ মগ্ন অইয়ে গেছি আরকি আইচ্ছা ইটাও ঠিকওই আগের খার মানুষের দিনহারতো একরখম খন মানুষের দিন াদজন রখম আবহাওয়া পরিবর্তন সব মিলাইয়া আইচ্ছা আর আধিনিকতার চোয়া লাইগ্গা এখন তো বুঝোনানি সবাইর খালি ঘরের বিত্রে মোবাইল ছুবাইল বারোই ওই না এখন বাইরের প্রাকৃতিক জিনিসগুলা কিচ্ছু দেখেওই নাকেও
valid_habiganj (19).wav,আইচ্ছা এখন এখন কিতাখন নিযে বৃষ্টির বাদ্লা দিন যে ছৈত্র মাসে তো খুব গরম তাখে এখন দেখা যাইগেতে ছৈত্র মাসে শুরুতে ওই এতো টাটা ফুড়ার ওইদের মদ্যে তাওয়ার খতা এই জাগার মাঝে বৃষ্টির বাদলা দিন ঘোর তিকে বারোনি যা না এখন
valid_habiganj (20).wav,ইটা সম্পর্কে তুমার কিন্তু আইডিয়া আছিনি বা কের ইরখম ওইতাছে ইটা সম্পর্কে কিছু তাখ ওই যে দেশের সবকিছুই ফরিবর্তন ওইতাছে ই খারণে ন ও টাইমে বিস্তি আগে কিন্তু রৃতলা আছিল ছয়টা এখন রৃহেতুর কুনু কিতা নাই বেলো নাই আইচ্ছা  যে কুনু সময় যেটা ইচ্ছা আযায় তোমার মেঘের সময়
valid_habiganj (21).wav,আইমো রোইদ রইতের সময় মযঘ কুনু ইতার কুনো লিমিটেশন নাই  যেবেলায়ইচ্চাইথুই আইয়যয় শীতের সময় আইয়ে মযঘ উক্কাথাকতো রোদ উককা ইাে মেগাইলে কেমনে ওইবো আইচ্ছা তো আর কিতা অবস্থা ইস্কুলো স্কুল কুন সময় কুল বলবো
valid_habiganj (22).wav,ওইতো ঈদের ফরে ঈদদের কিছুদিন ফরে কুলবো রমজানা তো দারুল কেরা তুরাতো ওই তুমি কেরা তুরাতো ফড়োরোনানি ওডা ওয় না আমি খালকাতত যাইমু টা আমি বর্তি ওই মাস কয়া দুই একদিন রেস্ট লই নে রেস্ট নয়টা আডটা বাজে যেমান লাগবো ছাইরটা বাঝে আমার লাগবো
valid_habiganj (23).wav,আইচ্ছা নাডা মাসত্তো তাখন লাগবো আইচ্ছা তে সেরিউরি হঠার সময় খাইলে আজকো আজকো খাইতে লেট ও গেছি গেউজকা উর তারছিলা আজকা তিনটা ফঞ্চাশে উইঠ্টা যেএসপিটে খাইছে হুখাইয়াদিকে ফরে মাই আরো ফোন্ডা মি লেট রইছে আইচ্ছা ফতা বেলা একটু গুম ধরে ওই টান্ডা দিনতো ঘুমেদর বইটে স্বাভাবিক
valid_habiganj (24).wav,চৈত মাসে যদি গরম থাকে য ততো ঘুমানে যাইতো না মানে গরম তাখলোনে রাত্রে গরমডা আইচছা আর এখন মোবাইলের খারণে মোবাইল ছালাইয়া রাত্রের ঘুমায় না তো শেষ অবে লা গুতা  একটা বাইজ্জা তাগা ঘুমাইতে গুমাইতে ককে এরফরে আর তিনটাসে মুরতারি না  যে ঘুমে ধরেছে
valid_habiganj (25).wav,ইসমরালা ফজুনের নামাজ ফরন্ত মিধ জায়গা বালা এইতো ইস্কুলো স্কুলো কুন সময় যাইবোতো ইস্কুল খুললে না কিদা ও ইস্কুলে যাইমু স্কুলো স্কুল এখন সময় যাইতা ছানো আগে তো আমরা খতো বড় একটা ফ্যামিলি আছলাম আগেন দিনোর খতো বড় ফ্যামিলি সবাই একসাতে খতো আড্ডা আড্ডা ওইতো খতো মজা ওইতো
valid_habiganj (26).wav,খতো খানি খতো খেলা উুক্কা দুইটা গুসতান আই উক্কা এখলাখলা বইয়া একটা গান আছে না ওই মেঘলা দিনে একলা গরে হুতা কেনা যেমন হই অইয় ওইরখম সবাই এখলাখলা তাহন লাগে উক্কা আইচ্ছা এখচা গানন লাগে না তো আগে তো মানুষে অনেক কিতা খরতো রুজা আরমজান আইলে মানুষে মনে খরো যে
valid_habiganj (27).wav,তুমার আগের তিকা গনতে ই রুজা আইতাছে  রোজা আইতাছে অখন তো আগের মতো কা ফিলিং নাই মানে একটা কিতা আছে না যে আনন্দ আছে না উল্লার খাছেনা যে রুজা আইতাছে অতদিন ফুরে ঈদ অইবো এবো সেই অইবো আমরা আমিও মনো খরো যে ছুটু তাকতে ইটার একটা ফিল তাকতো এখন দুই চাইর বছর ফাঁচ বছর ধইরা ইটার মনে খরো একটা ফিলিং নাই
valid_habiganj (28).wav,যে যাইক এখন সময়ের সাতে সবোই ফরিবর্তন আগে তো ইদ আইলে তো বুঝ যাইতো মানুষ নিয়া আছে আর কি ছিল্লা মিল্লে শুরু ওইতো আইঞ্জার ফর তিকি অইলো ছাদ দেখা গেলে উককা তো ইতো নাই এখন ইদ কুমদি যায় ঈদের দিনওই মনে তাখে না তে ঈদের কুনু মানে কুনু মজা নাই উক্কা
valid_habiganj (29).wav,আইচ্ছা সব মজা খাইলা লাইছে মোবাইল ছুবাইল ওই তোমার আধুনিক যুগ সোশাল মিডিয়া ইতা এনেনিসিগেট সব নষ্ট খরলিছে বুঝছিতো দিনখাল বালোই ইতাছে না আচছে বালো সব জিনিস পত্রের যে দাম বালা যাইতো কেমনে ও সরখারে তো জিনিসফর্তের দাম দিছে সব জিনিস বাড়াইয়া আইচ্ছা অখন ই বিষয়ে তোমার কুনু মন্তব্য আছে তাখলে খউ উনি এ বিষয়ে মন্তব্য কিতা ইন্ডিয়াত
valid_habiganj (30).wav,গুরুর মাংসে কেজি অইছে তোমার তিনশো টেখার মতো আর বাংলাদেশে আষটশো টেখায় দিয়া ইখানো ফাচ ছয়শো টেখা বেশি বেশি দূরা ধরি না কুনো ইন্ডিয়াততি বাংলাদেশর খাছাখাজেত তোইনানে ওতো দাম ওখা মাইনষেক মাংসে খাইতো কেমনে এরফরে বাংলাদেশোর আগে খতো ফলটিমুর গ একশ টেখা আশি টাখা কেজি অইতো উককা আইতা গেছে গিয়া আড়াইশো তিনশ টেখা কেজি
valid_habiganj (31).wav,তো কেমান খাইতো কেমনে সিনি খউ তেল খউ ফিয়াইজরেশন খউ যেতা ওই খাইতাম যেতা আমরার দরখার ইতারে খালি দাম বাইরে যায়গা তে আমরা কেমনে দাখতাম কেমনে ছলতাম কেমনে খাইমু যেহিত খতা এখন সরখারে যদি সাধারণ মানুষের হিসেব কিতাপ না বুঝে
valid_habiganj (32).wav,তেইলে কেমনে কিতা খরোইন যায় দেশের মাধ্যে মনে খরো ছাকরি বাকরিও নাই  আয় উননিিও নাই যেরার ছাকরি আছে আছে ওই যেরা সরখারি চাকরি খরে খাইতেছে ওই আর যেরা সাধারণ মানুষ এরা কেমনে চলতা যেরা দিন মজুর এরা খেমনে ছলতে এরার তো দিন মনো খরো ফাচশো টাখা ইনকাম হলে এক কেজি তেলের দাম হ টেখা খন
valid_habiganj (33).wav,এক কেজি তিল কিনবো না অন্যঅন্য একটা জিনিস কিনবো এখন সব মিলাইয়া দেখা যাইতে সরখারের খাছে আবেদন ইটুই আমরা আরাকি মনে খরো যে না কিতা িসপারতের দামটা এক া মুল্লা আ লব মূল্যয় আনতো য তাইল তে সাধারণ মানুষ তিকি নি গরীব সবাই যাতে খাইতা রে ছলতারে
valid_habiganj (34).wav,তুই আমি ছাই ইটুই খরতো আর শেখ হাসিনা ইতো খালি যেরা তোমার মুক্তিযোদ্ধা এরা রেকউটও বেশি আর যেরা সাধারণ মানুষের আরতো কুনু ক ন  আমি মনো খরি যে দেশের সব মানুষে সমানদী নানতসমান দবে রাখতো ঠিক আছে যেরা কিন্তু মাসিবাতা হিসেবে বিশার টেহা ফায় শেখ আাছি না খ ইটা আরো বাড়ানে হোক
valid_habiganj (35).wav,কিন্তু সাধারণ মানুষে কিছুএকবারে কিচ্চুই ফায়ে না এরা এডা কেমনে ছলতো খাইতো তে ছাকরির ক্ষেত্রে সব পায়ারুটিয়্যার আরোই সুযোগ সাবিদা  সুযোগ সুবিধা সবেরান খন কিতা খরবাইরে বাই াটি ফুরি সে নৌককা কিতার এই যে তুমার খ স্বার্থর উফর আর কিতার উফরে
valid_habiganj (36).wav,এখন কিতা খরবায় সূর্য মূর্য খইরা ছলন লাগবো এখন চেতাল দেখছি ইরম তাল তাখলে দে শষদ এখন যা ম  াাখবো আরকি দেশ টিকা বুঝছো না না  বাড়িছ আনেন দেখলাম বা একটা রেল লাইন ফুরান ইটা কিতা বাই ইটারে কিন্তু ইতিহাসে জানুনিটা কিতা ফুরান ছলে উলে নানি নাকি ত ইচ্যা ইতিহাস বলতে আমি তেমন জানি না ইতে আমার বাপছারা দাতি উনছি আকি
valid_habiganj (37).wav,ইেরা তাকতে আছিল আমার আমার জন্মের সমিন তেক বলে ইটা নাই গেইছে তে রেল লাইন মিললা মনে নাই অইছে এইডাা ইটা ওই খত জামেলা তাখা না নি খতমনতে খতো ফিংসিং লাগাইয়ে ডেইন কতেনা আসলে একটা এলাখারে উন্নত ওইতা দিনডা আগে আচছা রেলের যে লাইন লাইন ওই যে তুমার রেল লাইনগুলা আছলোই
valid_habiganj (38).wav,ফাতগুলা ফালাইলে আছলো বা খাটের তো একটা সিলফার ডেল বাডা আছলো ইডা কজন কতা অইছে এই সিপমিক মাইনষে টেখা পয়সা নাই কিতা খরতো বেইচ্চা খাইলাইতাছেইনা আচ্ছা দেশের সম্পদ টা খা ছ ম বেইচ্চা খাইলাইতাছে কিতা খরচা  বাইচ বাস্ত ইবো তো খাইয়া তো তাকত ইবো ও রেলডা দাখলে তো  এলাখাডো একটু না র রেল লাইন তাখলে খতো সুন্দর খুব কম সময়ের মাঝে
valid_habiganj (39).wav,যেখনগা যা যেকুনু জায়গাত খতো বালা বাট রেল লাইনের ফাশে এলাহাগুলার খত উন্নত তাখে  খত সুন্দর হ্যা খত সুন্দর তাখে খাটাখাটি খরা যায় রেল লাইন দেয় ইটা আরও খতো বিকালে খুব সুন্দর সময় খাতে বন্দু বান্ধব লইয়া খত সুন্দর রেল লাইনে বইয়া আড্ডা দেওন যায় ইতা আমরা খুচতা খয়তাফরি না
valid_habiganj (40).wav,আমরার স্যার ইডের লাইনটা আবার ওউক ও উনলামনু বলে এডভুকেট বাবু বালি ইডা নাকি উদ্বোধন খইরা গেছে রেল লাইন আবার ওইবো ইটি সম্পর্কে কিতা তুমি জানু  যখ তাইে কিছুদিন ফর ফরে আইন মা ফোইন  সসিটন অইক ওইলে তো মনো খরো যে ইটা ইন্ডিয়ার সাতে নাকিতা বলে এডিয়া ট্রানজিট খরবো
valid_habiganj (41).wav,খরলে তো বালা ওই খরলে তোা বাল্লা একটা স্থলবন্ধরও খরতাছে  দেখতাছে এখন খাম টাম খরতাছে মাইনছে সেতুটিতো খরতাছে দেখলাম বিবিন্ন জায়গা ত বড় বড় খরবু হিশাল আমরা আশাবাদি খরবো খরলে তো বালা খরলে তো সবারই বালা খালি জনগণতে বালা দিতেমন তো না সরখারেরও লাভ
valid_habiganj (42).wav,বিবিন্ন উপাদানটা উৎপাদনটা উৎপাদন ওইলো ইগুলাদে আওয়াজ াওয়া খরলো আর একটা জিনিস কলেডেরতে তো টেখা উঠেওই না উঠেননে কুনু ট ে সবকিছুতে টেখা উঠে  বর্তমানে যে এখন মেট্রোয়ের খরলো ইডার তিি বউত টেখা ওদে খরচ খইরা মেট্রোয়েলডা খরছে কিন্তু দেশের একটা মানত উন্নতিতোটা জিনিস আলো অর্দা সেতো
valid_habiganj (43).wav,ইটা ইটা খতো বড় একটা জিনিস ইটা খরলো বাংলাদেশের মতো দেশে ওত কিন্তা একটা দেশে খইরা ফালা দিলে ওতো বড় খাম ঠিক আছে ঠিকআছে আইচ্ছা ঠিক আছে তে বালোই তুমার সাতে অনেক সময় খতা খতা খইলাম তে বালা দেখো আইচ্ছা  আমার সাহেদে য়ত লামি মাত লায় বাইতে কিতা কেমনে কিতা অইবো আমার বুঝে নাইতে তুমার জিগাইলাম খইলা যে খইলাম তুমার সাতে একটু গল্ফ উজোব খরি ইডার রেকর্ড উগ্ড খরলাম আইচ্ছা তে বালা দেখো
valid_habiganj (44).wav,তা আইচ্ছা হ বালাতা খবা হ ওকে ওকি আর্ছালে আমার এই কুম বাইালাগিমসালা
valid_habiganj (45).wav,সালা মলা দখন সাসিম মা কিদা অবস্তা ভালা নি এজুমারসাল্লাম ভালো ইয়াছে কিতা খরো ও খাপড় দিতাম পাওটাও কিলতাছি রোজা নিয়াজ কোয়া অ রোজা ওই রাখছি আইচ্ছা যখন তুমার সাতে একটু মাত মাতলাম নে আর কি দিন হালকি রখম যাইতাছে বালা ঘুড়া সে বিষয় অখন খতাগুলা যদি ই মুবাইলোর রেকর্ড গট করি
