id,sentence
valid_narsingdi (22).wav,রাজুনি মানে মুশল্লাহ বিরানী মুশল্লা ফতম তমান মাংসে গেলে দুইয়াতোল দিয়া তারফরের মযে রসুন পিঁয়াজ এ  মাংসের মইদ্যি দিয়া স্ববন না না নার মাখা মনে আর খেইতা না না ফথম চ্যাল দিয়ে তারফর রসুন পিঁয়াজ ডা একটা
valid_narsingdi (23).wav,মানে হালকা বাইত যাইয়া তারফরে তোমার আদা রসুন মানে সব মুসল্লা দিয়া এট্টু কসামু কশে সেরার হচ্ছে গরু গুছ্ত অরা দিমু ও এডি কশে তারপরে মাংস মাংসদ মানে কশে সেইরা মাংসদদির মদ্যি আইসি হারে তোমার মনে করো মাংসডা ইটু হালকা সিদ্ধি আসালে
valid_narsingdi (24).wav,ফরে ফোলা ওর ছাওলডা দিমুই স্কোলার চাউল কি বিজায় রাখতে অয় আগে না একটা না দুইয়া সাথে ততে দিয়া দিমু ও দুইয়া   লুয়া দিওয়া দিমু তারফরে ইডার মদ্যে তোমার মনে করো একটু াজা কইরা ইডার মদ্যে মটরছুটি আর গাজর দিয়া ফরে গরম ফানি দিমু গরম ফানি দে এমন করনো দশ মিনিট
valid_narsingdi (25).wav,তোড়া ফাগুটে শাললে তারফরে টালারা দিয়া ডাইক্কা রাখমু তের মনে কর আখবে দশ মিনিট ফরে আরেকবারে একটা লারা দিমু  দশ মিনিট ফরে ফরে মানে আনা দশ মিনিট ডাইমানে ফাগুট্টা শাললে তারফরে এডা দশ মিনিট ফর ডাইক্কা রাখলে অমাকো দশ পন্ড মিনিট ফরে আবার ট
valid_narsingdi (26).wav,দারা দিয়া নামাইর নামায় রেইখ্কা দিমু রাইখ্কা দাইে তারফরে য সুন্র বইন ফরে ফোলাও ছাউলডা চুটটা যাইবো বিলাইনি অইয়া গেছে কুল্লার চাউলছি তনা পরি বিরাা রাখতে অইবো না কনা না আ ছুলানা যামানে ফাকুইর্টা শালরে বিরাইনি নামাইলামু  সরা ফতেটটা শালরে হুচ্ছি মা আমি পানির পরিমাণডা কেমন অয় র আমনের পরিমান ডা মেয়ে হাত দিয়া দি আমি কুনু মানে এম্নে অনুমানে বুঝি না
valid_narsingdi (27).wav,তোমার মাক হাত দিয়া অনুমান করি  মাদে হাতের গাইট মনো যায় মাব দি ও চালে রুমা তলে ফরতে ইক্কা তোমা মন করি  দুইল গাট আন তরতো আল্লা যতগুলো চাগল অই ও আইচ্ছা চাউল বুইজ্জা ফড়েল ওই পানি ান পানি ক গ াতে আললা চচছাট চাওলে দুই ভাইট
valid_narsingdi (28).wav,ফোনতো আমি মনোমাল কইরা দির আচ্ছা ঠিক আছে মামির কাছতে বিরা নি যে সিপিডে জানলাম তো আমার লগে আমার দুইটা বন আছে নওরা ওরা আসলেই রান্না টান্না পারে না তো নামবল
valid_narsingdi (29).wav,নাম কইত গর নামি না ছোট বনের নাম নাম্বল আমার নাম ইসলার যে হান্দুব না আইচ্ছা তুই কুন ক্লাসে পড়স এবার এসএসসি ফরীক্ষা দিব এসএসসি ফরীক্ষা দিবে আমার আরেক বনের নাম নাম্বল লা আমি এনন ছাতলি বা কোন ক্লাসে পড়  ক্লাস এইট
valid_narsingdi (30).wav,ক্লাস এইট ওরা আসলে তেমন রান্না টান্না পারে না া আইচ্ছা ামি মামির কাছে আরেকটা রান্নার রেসিপি জানি মামি হালিমোও খুব মজার কইরা বানাইতে পারে আমি হালিমের রেসিপিডা কলওতমতো মাইনষের এটট মানে মাংসি খাট
valid_narsingdi (31).wav,তুই ছোটু কলে পিস কইরা তারফরে পিঁয়াজ কাটটার দন্য পাতা শশা এগু লোগা একটা রাখি রাইখা তারফর তোমা তেল দিয়া ফাস্ট পতম তেল দি তেল দিয়া খেরে এই পিঁয়াজডা বাজি বাইজ্যেসেরে পিঁয়াজ উঠায় রাইখে র এডার মদ্যে মাংসডা
valid_narsingdi (32).wav,দে দিয়া না কি সবটি উডায় না না ল মানে  অল্ফ রাইখ্কা অল্ফ ফাতলের মাদ্যে রাইখ্যা আমার হিডি উডায় রাহিঅর বেরেস্তাডা বরে যাা পরে অর্দে আইচ্ছা তারফরে ইডার মদ্দে তোমার মুরগি মাংসো বা গরুম আংসে যা জিয়ারান যে ইরা মাংসেরা দিয় দিয়া শাহরা হালি মসরুল্লা দিয়া
valid_narsingdi (33).wav,ইডা কষায় হালিমের ম  হালিম ফাক করার আগে তোমার গরম পানিত যাবো হালিমরা বিজা মানে এইটা হালিমেজিডাা লা ইডা বিজায় রাখি হরাসকা ফ মাংসডা কশে সেরার পরে এই হালিমডা দিই ও ইডার যেডা দিয়া বিজানেরাতকি আবার পানির পরিমাণ আছে না মানানছা  যে  মানে
valid_narsingdi (34).wav,যতটুক ইচ্ছা মদেতো মানে হেই ফাত্তে অইবো না গনগরাবাা গ তারফরে ইডা দিয়া সাইরা অনেককুণ টুজবাল দিয়াযহন ডাহলডা ছিটবো তহন নামাইরাহি এক্টু গর আসালে তরে বাড়ির মদ্যে লইয়া তোমার মুখর হালিম দিয়া ইডার মদ্যে
valid_narsingdi (35).wav,ব্যররেস্তা যিডা ইডারা ইডা দেই মরি দেই লেব ধন্না ফাতা সমস্যা য়গুলি দিয়া ফরিবেশন করি স স সমস্যা দিহে গরলি দি পরিবেশন করি আইচ্ছা আইচ্ছা মমামি থ্যাংকিউ আইচ্ছা আমি একটা রান্নার রেসিপি কই আমি যেডা পারি আরকি আম্মুর কাছতে যেডা শিখলাম গরুর মাংস
valid_narsingdi (36).wav,অতো ভালো পারি না তাও যেহেতু বাসায় বাসায় থাহি বাইরে থাকলে টুকটা কিছু রান্না করাই লাগে তা গরুর মাংসের রেস্পিডাই কই প্রথমে গরুর মাইংসডা
valid_narsingdi (37).wav,কুচিকুচি কইরা কাইটা যারপরে আদা মানে আদা না হলুদ মরিচ যা আছে ওইগুলা দিয়া মেরিনেট কইরা মানে কতক্ষণ আদা ঘন্টার মতো রাইখা দেই কি আমি যেমনে রান্না করি তো আদা ঘন্টার মতো রাইখা দেই তারপরে ওইটা রাইখাই পিয়াজ মরিচ মানে যা যা লাগে ওইগুলার ব্যবস্থা করি ওইগুলা আগে কাইটা গাইট
valid_narsingdi (38).wav,কাইটাডা ইকটা তারপরে রাইখি মানে সময় বাচানোর লাইগা আরকি তো ওইদি তেল দিয়া পেঁয়াজ পেঁয়াজ মরিচ রসুন এগুলা কাটার করে একটা কড়াইতে তেল ঢালি ওই পরিমাণ মতো তেল নাই আরকি তো তেলডা গরম হইলে তারপরে এনে পেঁয়াজ রসুন
valid_narsingdi (39).wav,মরিচ সবগুলা একসাথে দিয়া ইটা বাদা মিবর্ণের হইলে তারপরে ওইখানে আচ্ছে কটু পানি দেই আঁদা রসুন বাটা যা যা থাকে ওই আদা রসুন আঁদা বাটা রসুন বাটা পেঁয়াজ বাটা এগুলা দিয়া তারপরে ইটা কষায় আরকি সামান্য ফরিমাণ লবন দেই
valid_narsingdi (40).wav,পরে আবার লবন দেই তো ইকটু পরিমাণই লবন দেইা গেই তো লবন দেওয়ার পরে ওইডা কসানো অইলে পরে মাংসডা যেডা মেরিনেট কইরা রাখছিলাম ওইডা দেই ওইডা দিয়া তারপরে পরিমাণ মতো আবার একটু পানি দেই পানি দিয়া তারপরে আবার ওইডা কশাই ওইডা ঢাইক্কা রাইখা দেই
valid_narsingdi (41).wav,তারফর এইডা সিদ্ধ ওইলে আবার লবন দেহিকটুও তারপরে এইডা আবার ঢেইকা রাইখা দেই তারফরে এমনে আর কী হয়া যায় পানি দিয়া ঢেইকা রাইখা দিয় তারপরে কটু বলপরে নারতে থাহি আবার তো এমনিতে ই মাংসডা যখন হইয়া যায় মানে একটু নরম ওয় তখন আবার একটু খাইয়া তো অবশ্যই দেখি
valid_narsingdi (42).wav,যে হইছে কি না তো ইডার ফরে আবার খাইয়েটাই দেখি যে হইছে কিনা হইলে তারফরে আবার মাঝে মাঝে আম্মুরে কল দিয়া জিগাই যে অইছে না কি কেমনে কী করে তো আম্মু কয় আবার মাঝে মাঝে হয় আবার হয় না তো হর লাইফে এমনই হয় আসলে রান্না বান্না সবকিছু যেমন হাফ
valid_narsingdi (43).wav,ফুরা হাফশিদ দে মন হয় তে এমনই খাওয়া লাগে যে মন হয় আরকি তো এই এই মাংসের রেসিপি আচ্ছা আমার আমার লাগে আমার একটা আন্তিও আছে তো আন্তি নাম ভডা
valid_narsingdi (44).wav,আনটি নাম এডা আঞ্চলিক ভাষায় আমি যেমনে কতা কইছি এমনি তাহ মিনা আক্তার তাও মিনা আক্তার স্কুল ক্লাসে পড়ছ ওডা ক ইন্টার সেগেন্ড ইয়ারে ও আনতি আবার আমার ছোড আবার তুই কইতাছি দেইক্যা আমার ফরেম কিছু মনেক হইরের নাও কিন্তু আমার ছোডো ও ইন্টার সেকেন্ড ইয়ারে পরে
valid_narsingdi (45).wav,আচ্ছা আন্তি তোর পছন্দের খাবার কি মানে যেরা তোর বাল্লাগে যেডা খাইতে ইচ্ছা করে সবসময় নুডেলস নুডল স্যার কি আর অইছে ইলিশ মাছবোনা ইংলিশ মাছবো না আর মুরগাল মাংসা আর মুরগের মাংসা
valid_narsingdi (46).wav,আইচ্ছা আর তুই কি রানতারছে এইডা কও আন্টি আবার রান্না টান্না ভালোই পারে নুডলস রানতিপারি আবার ডিম বুনা রানতে পারি  নুডলস কেমনে রানতাছে ইডা ক নুডলস প্রথমে গরম পানি বসাইয়া ফরে
valid_narsingdi (47).wav,নুডলসটা ইয়া গরম পানিডা পাগ উঠলে নুডলসটা দিয়া গরম কইরা নুডুলবোর মদ্যে দিয়া সিদ্ধ কইরা সিদ্ধ কইরা ফরে এইডা সাইকে পানি দিয়া ধুইয়া মুইয়া প্রথমে পিঁয়াজক দিমু তেলের মাঝে ফরে ইয়া
valid_narsingdi (48).wav,কাঁছা মরিছ ফরে আবার ডিম আবার নুডুলসের মশলা ফরে এডা এট্টু নাইরা মাইরা নুডোলস দিয়া ফরে এডা আবার নাইরাটা ডডা নুরুলসের মসলা দিবু নাকি আলাদা আবার লবন টগুন এডি দিয়া অগানে আনি লবন টবন দেওয়ার লাগে না নুডলসের মশলা দিলাা মসলা হএইডা এডাই তোর পছন্দে
valid_narsingdi (49).wav,আইচ্ছা আর আর কি পারছ আা নুডুস ছাড়া নুডুস তো এডা সবাই ফারে বাচ্চা পোলা ফাইনা পারে আর কি পারছ ইডা ক তো এডা আমার ছোডো ভাইও পারি নুডুল আ মুরগার মাংসডা রানতি লাদি আইচ্ছা মুরগির মাংসে কেমনে রানতেছে এইডা ক
valid_narsingdi (50).wav,সব কবি আইচ্ছা মানে যেমনি যেমনি তুই রানতজ যাআজা লাগে সব কবি হুরগাডা কাইর্টামাইর্টা ধুইয়া বালা কইরা তারফরে পিএসটিএস কাইর্টা রসুন বাডাটাডা দিয়া ত্যালের মধ্যে ফরে আবার এলা আবার খাল
valid_narsingdi (51).wav,আরও লং টং এইসব দিয়া ফেজ পাতা দিয়া ইট্টু নাইড়া টাইরা বাজা অইলে এডার মাঝে যিরা আদা য়াডা রশুন বাডা দিয়া আবার ইক্টু নাইড়া টাইরা হলুদ দএরগুরা মরিচেরগুর আবার অনেকে দিলে হজের গুরাও দেয়
valid_narsingdi (52).wav,এইসব দিয়া নাইরাটা ইরা এট্টু পানি দিয়া কসা ইয়া ফরে আলুদিলী আলুদিয়া আবার কুশ লিয়া সব কষে আলু কী সিদ্ধ আলু না কাছো কাছা আলু  ছে আলু দিয়া যদি আলুদেআয় অনেকে আবার অনেকে দেয় না ফরে আলুটা কাইয়া ফরে ইট্টু ফরে আবার মাংসরা দিবো এডার মাঝে
valid_narsingdi (53).wav,আবার নাইরা টাইরা ডাকনা দিয়া ডাইক্কা রাখমু কষাইয়া ফরে কশান হইলে পানি দিয়া পানি দিলে পানি যদি বাগুডে তাইলে লবণে যদি মানে লবণ যদি হয় তাইলে আর দেওয়ার মতো ইতো না আবার যদি না হয় তাইলে ইট্টু দিতে অইবো
valid_narsingdi (54).wav,আর ফরে তো ফাগুড়লে যদি জ্বালে হাইয়া তাইলে উডাইলাইগু যদিডা ক ওইডা আইচ্ছা আইচ্ছা এইডা কি পানি টানির কোনো কিছু পরিমাণ আছে না না এডা পরিমলে মদদে এা মানে মুরগার
valid_narsingdi (55).wav,অনুযায়ী বুইজ্জা মুর গা কতা টুকই এইটা অইযে বুইজ্জাও আইচ্ছা মুরগি যট্টুক বড় হ ড শুকনা করে অনেকেই আবার বুনা  যেএডা শুকনা করে ওইডাত কি পানি কম দেয়া ওইডাত পানি কম দেয় আর যেরা জোল লাহে এডার মাঝে পানি বেশি দেয় ও পানি বেশি রায়ে আর শুকনাডাত পানি শুখা ইয়ার পরে সুা য়রাহ আবার অনেকে ইকটু রাহে ম
valid_narsingdi (56).wav,আচ্ছা থ্যাংক ইউ আচ্ছা আমার লগে আমার আরেকটা মামি আছে তো শুটকি মামি মামির পছন্দ শুটকি ইবো না তমামির কাছতে শুনি শুটকি হইবো ন আর রেসিপি মামি কন
valid_narsingdi (57).wav,সবা শুটকি পছন্দ করে না সবাই সহিত্তা ভাল্লাগে তালে বাড়ির সবাই শুটকি খুব পছন্দ করে নমি শুটকি ছ তযকন রসুন প্েচ কাইচ্চা ভালো কইরা শুটকিডা ধুইয়া ত্যাল বেশি কইরা দিয়া রসুন প্যাসট একটু আনায়া
valid_narsingdi (58).wav,তারফর দে মরিচ বাইটটা মরিছে দিয়া মরিশটা আবার আলাদা বাটনাম কাঁচা মরিছ না শুনা া মরি কনা মরিচ বাইটসা কনা মরিচ বাটটা চছ বাইট্টা ফরে শুকলাম মরিজ বা হলদো ওগুরা অল্ফ দিয়া ফরে লালারাটেরা এক্টু ফানি হা অল্ফ এট্টু ফানি দিয়া তারফরে এই শুটকিটা দিয়ারা
valid_narsingdi (59).wav,কতক্ষণ বাইরাটারা পানি শুকাইয়া গেলেগা ত্যালে চপ সপ করলে শুটকি বুনা ওইয়া যাবেগা ও এডেই শুটকি বো না হযা শুটকি বুনাডা আসলে সহজ কিন্তু তালার লদেডালেম ফতাও দিয়া দিবা মাগে উফরে ফড়ে মানে ইডার লগে ন আরকি ওই ওইলে ফড়ে
valid_narsingdi (60).wav,আইচ্ছাহেতছে চিংড়ি মাছ  আইচ্ছা শুটকি বোনায় চিংড়ি মাছও দেহা যায় অনেক কিছু আসলে শিখতাছে এসাইনমেন্টের লাইগা মরিচ বাইতা লইলে মরিচের ঘুরা না দিয়া মরিচটা বাইত্তা লইলে বেশি মজা লাগে না
valid_narsingdi (61).wav,হঅনেক কষ্ট আসলে এরা আসলে রান্না টানলা মিয়া অনেক মনে গবেষণা করছে কুনডা মিশীমজা কুনডা বেশিা আইচ্ছা মামি আরেকটা আরেকটা আমনের পছন্দের ক খাবার এডা কন ওইডা রেসিপি না কইলাআমনের কি খাইতে ভাল্লাগে
valid_narsingdi (62).wav,আমনের ফছন্দের কি খাবার আছে আমকি খাই কচ্ছু না তমআমি কিচ্ছা খায় নামামি ফছন্দের খাবার নাই আমি একটা ফছন্দের খাবার কি বেডাইলদা কবিদাখা ওম মি মামির আরকি মি আমার যে বইন আছে তাহ এর র কি কপি ফুল কপি চছামা আমি ফুল কপি আর ডালেট রেসিপি ডাকন
valid_narsingdi (63).wav,ওইডা ওইডা আসলে আমি দেখছি যে সব জায়গায় অয় না ফুল কপি ডালের যে রান্নাডা ওইডা ওইতো কা টা সব জায়গা অয় না ম ফুল কপিডা ছুটো ছুটো কুটা কাইট্টা তারফরে ডাইলডা অনেকক্ষণ বিজা রাইখকা ফরে এডা ডাল তোল
valid_narsingdi (64).wav,তযল রসুন পিঁয়াজএডি দিয়া করাইয়ার মাইদ্দে লাইয়া টাইরা ডালির মইদে ফানির না দিয়া বিজায়া রাখছি যে এইডা ইলে ছাইতয়া দুইয়া ভালো কেইরা আমারে করাইয়ার দিয়া টাকমাদা ঘুইরা রাহু ফরে আস্তা আস্তে সিদ্ধ অইডালটাসিদ্ধ অইলে
valid_narsingdi (65).wav,ইয়ারা দিমু  কবিডা দিয়া ককিছুক্ষণ লাইরা টাইরা মানে ক ক্টু কাছা কাছে ই উড়াই া টাইরা করে হ ফরে উডাই লাই কতো সহজ আছে ফুল কপি আর ডালের ইয়াডা আমারে খুব মজার লাগি আমালে  দিওন লাগে
valid_narsingdi (66).wav,চিরার চিরা হলুদের অল্প সামান্য কিরা আইচ্ছা আর আর আম্মুর কাছতে আরেকটা জিনিস আমার আম্মু যে নিরামিষটা রান্না করে গ্রামের গ্রামের দিকে আসলে ওই সবজি টবজি অনেক বেশি পাওয়া যায় তো ওইডি নিয়া আরকি ইগুলা পিউর সবজি
