id,sentence
valid_sylhet (136).wav,তো এর বাদে আসলে আমার মেডিকেলো এরার লগে আমি স্বার্থব্যাখট সম্পর্ক রাখতাম ফাইলাম রিসিশন নিলাম আর সিদ্ধান্ত নিলাম আর আর বাদবাকি যারা আমার ডিনি সার্কেল যারা আছিল তারার লগে আমার গজিষ্ঠ সম্পর্ক তারার লগে আমার এখন খুবই বালা সম্পর্ক লহামদুল্লা সব সময় তারার লগে তাকি তাার যেকুনু হেল্পফ ো ফাই
valid_sylhet (137).wav,আমার প্ল্যান আসলে এম্বিবিএস ফাশ খরিয়া যদি ফাশ খরিয়া আলফ্াননি অইয়া আমার অনেকগুলা ইচ্ছা আসলে কুন ইচ্ছা সটিক আমি খইতাম আারলাম না আমার প্তিবার  খতা ছিন্তা খরিয়া পুজিশন নেওয়ার লাগি আমি ওইলাম মানে একমাত্র সুন্দান আমার মাবা ফদের লাগি বিদেশ আইবার আগে ওউ জিনিসটা মাত্র দেখা লাগে আমার আমার প্ল্যান আছে আমি আমার সৌদি আরব বা মেডিলিসটো কুনু কান্ফ্রিত ইচ্ছা আছিল এখটা যে আমি যদি লাইসেন্স
valid_sylhet (138).wav,ফাই যখনো গিয়া মেডিকেল প্রাকটিস খলমু আর সাতে সাতে সাতে সাতে ফিক সারিয়া ফুরান খালিফ র উফ্রে ব্যাচেলার্স খলমু হমদিনা ইউনিভার্সিটি বা আজহান ইউনিভার্সিটি ওতা ইউনিভার্সিটি তাকি আমার ইচ্ছা আছে যে এখটা ব্যাচ গাস লিমু আর সাতে সাতে আমার মেডিকেল প্রেক্টিসো খরমু েশলাইসেন্সি একসাম তেয়ার খরিয়া আআর যদি বিদেশ না যাই কুনু মুসলিম কান্ট্রিট না বিদেশ মাইগেত না খরতাম বাি যেতো আর দেশো তাখমু ওদের সাতেকিয়া পোস্ট ক্যাজিয়েশন
valid_sylhet (139).wav,খরমু দেশোর মাঝে আমার আমার তো আসলে নিজোর বাষাও লালাদিগি আমারআব্বা আম্মা আ আব্বা আম্মারটা আমি ছ্যারে র খেউ নায় তারে লিইক্কা রাখা আর ইুতো ইসলামেও খয়ন য় তাারে লিইক্কা রেখা বাবা ফ্রেইলা একসাত ইয়া বিদ্দ বয়স যাইতা না যারা এখটা হারিস আছে যে যেসব মানষে মা বাফরে ফাইলো কিন্তু তারা কগুনা মাফ রাইতো ফানরে না তারা ধ্বংস ওই যাব আর রেম আর আরেখটা জিনিস রেমফিটোর এখটা পরিকল্পনা আছে যে
valid_sylhet (140).wav,শরশরিয়া হাসপাতাল প্রতিষ্ঠা খরা বাংলাদেশো সিলেটো ইনশার লাইকটু প্তিষ্টা মে আমির কিছে খাম খতা মামদে খাম খতামর এমফিউটোল যারা আছি মালায়েশির সাম মেডিকেল সাইডের যারা আছি ইনশার লাইফটা যদি ওই যায় তেতো আমি লমফিটোর সারিয়া হসপা ইনশাল্লা আমার এখটা পউস্থা আখ আমি জব খরোতো ওইযে রেমফরিট খরিমে আর শরিয়া াসফাতাল খো ও দুইডা দিলেশাডলাফো ইরি স্কুলা টিকা আচ্ছা রেমফিড অইলো রিসার্চ একাডেমিক ফর মেডিকেল ফরিকাল ইসলামিক ট্রিটফযান্ট  আর শারিয়াছ
valid_sylhet (141).wav,ফানের বিষয় ওইলো যে ইসলামো সবগিলা সারিয়া মেন্টিন খরা মেন্টিং খরিয়া এখটা খাসপতা প্রতিষ্টা খরা যেমন অটিন ক্েত্রে দেখা যায় যেএএখজন মহিলা দরটি ইসলামি সারিয়ার খতায় ইদ অটি কুনু মহিলা ছাড়া আর কুনু পদিষ থাখতো না এর মানে অইলো এসারজন মহিলা য় এখজনমহিলা যদি যুগই অয় তে সারজন মহিলা অইবো এনএসসএসিল মহিলা অইবো এসিস্টেন্ট মহিলা অইবো
valid_sylhet (142).wav,সব যারা ওয়ার্ড বয় নার্স যারা আছে সব মহিলা ওইবো কিন্তু ই জিনিস কিতা বাংলাদেশোমেন্টের খতা ওয় মাইজে খরা ওয় না কিন্তু এখটা সারিয়া হসপিটাল সারিয়া হচ্ছে ওয়ার্ল্ড বিশ্ব আদর যেতা জাগা আছে মালোয়েশিয়া ইন্টানেশিয়া রখ মালোয়েশিয়া ইন্টানেশিয়া যে শারিয়া হসফিটিা আছে তারা ইতা মেনিন খরিা ছলেরআমরার ওউরখম ইচ্ছা তারবাদে ফরত্যেখটা ডাক্তারযে কিন্তুানেঅনেখ অষুধ আছে তাজেলাটিন জেলা কিন্তু এর খরা ওয়
valid_sylhet (143).wav,্তান মানষের অশিক্ষতার ্যাল ট্যাল দিয়া শুরক ার মানষে দিয়া আর ই জিনিসগুলা আমনে দানা রাখা তাক নতোফত্যেক ডাক্তারতো যে আনে রাখা  তুনতুই যে অসুই ও
valid_sylhet (144).wav,স্যার ওতো ফি নিদিদি ন ওয়া লাগবেন দ যেকর ইসলামিক সাইডটা আরটক্রমোশনা সাইরটা এখলগে মেইন্টেইন খরিয়া যা
valid_sylhet (145).wav,মি ছান মা খলেজি ওউ বিষয়
valid_sylhet (146).wav,ওউ জিনিস খল অয় ওইদেনাতাইলে তোর লগে মাতিয়া বাজা লাগলো ওটে আশা খরি তর আশা আল্লাম পূরন ফরতা ত মন দু বালা নাগবেছ
valid_sylhet (147).wav,যে এমন কিচ্ছু নায় আসলে যতোটা এক্সপেক্ট খরি ইটা কুনুসময় ম্যাচ অয় না ইটা এখনকার জিনিস বাট আসলে ছুটবেলার ইন্টারগুলা বন্ধু বোস্ট আছিল মানে বার্শিক ফরীক্কা শেষে ডিসেম্বরোর যে মোবেন্ট গুলা এগুলা আমার মনো য় না লাইফো খেউ জীবনে দ্বিতীয় বার ফাইবো বিকজ নো বার্ষিক ফরীক্কা শেষ ফরীক্কা যেদিন দিতাম হেদিন মুকোর উফর তাখি যে ফার্তবটান আমি জিতো পৃথিবীতে আর কুনুদিনও  অতোরইলি ফাওয়ার মনো য়দিন আড়াইবো আশুনু আর এমনি তো টিকা আছে তর যখন ডিসেম্বর আইতো আফনার আমরা মানে
valid_sylhet (148).wav,বার্সিক ফরীক্ষা শেষ ওই যাইতো এরফরে কিন্তু আমরা এখটা সামরিক সময় লাগি এরা অসাধারণ স্বাধীনতা উপমুগ খরতাম আমরার কুনু লিমিটেশন নাই বাসাত যাওয়ার কুনু মানে বছরো এখটা সময়ও আমরা সন্ধ্যার ফরে বাইরে তাখার স্বাধীনতারা ফাইতাম এবং এইটারে ছতভাগ উপভুগ খরার যে চেষ্টাটা ইটা আমরা সবসেয়েম তাখতো যেমন দর বছরের এখটা সময়ও কিন্তু আমরা সন্যার খরে বাইরে তাখতাম বারতাম আমরা দর ব্যাডমিন্টন খেলা তাকি শুরু খ আরো যাদে টার খরা যায় তইবে সাইরেই করানোর চেষ্টা খরতাম মানুষ আেো
valid_sylhet (149).wav,কিন্তু এখনকার ইটারগুলা মদ্যেসব্রিত ডিফ্রেন্ড এখনকার ওইরযানগুলা কিতা যেসুবুটাখন একটা ওই গেছে মরে বোর্ডি যেমনে ফলে ছা আমরা ফি খরতাম ছাইরাম বাট আসলে কু খতডুক আমরা শেষ বেশ ওইতাম বার ইটা আমি বুঝতামা সপোরোর লাইফটা অলাউ যে সারা বছর ওইটার লাগি ওয়েট খরিয়া আছিসলশুর  টারাইলে আল্টিমেটি তিছুওজু খরা অয় না নাটুট দাওয়া অয় না অনো খনো যাওয়ায় কুচ্চু অয় না বা টিক আছে তারফরও বন্ধু বিস িজ লাইফ আজকো যেসময় টারে বাদ খইরাম দশ বছর ফরে ও সময় টার লাগিও প্রস্তাইমু ইটার নামু লাইফ আসটা  াবুচ্চ স্যারই বন্ধু
valid_sylhet (150).wav,তোমার তো র কিলান যা বন্ধু বা তোর স্বপনা দিক আছেনআমার ঠিকটা  তোর জাগা আমার উমলা  তো তো শীতর সেজনতো আইলো শিতর সিতনা তো আমরার যাওয়া অয় তারমি আরনো ফাতি খাওয়া য়  ওটার ব্যাফারে তুই রেডিং দিলাগিবে কিলা লাগছে তা ঠিক আছে কিন্তু তারো মিয়ার সব ইনট্রেস্ট িক যে ব্যাফারটা দর যে ফরতমত ওইলো গিয়া এখটা ছুটখাটো রাইড অয় তোর গাড়ি দিয়া যাই বা বাইক দিয়া যাইয়া টা শুরু খয়রো রাইড অয় আসলেই রাইটের এখটা মজা আছে এই তারো মিয়া টা যদি শহর ইবেলেবেল ো আমার মনো অয়ন আমি খুব এখটা প্রিফার খরলামনে
valid_sylhet (151).wav,জাওয়ারটাত বস্তি উঠলেই কেনো কোনো সময় প্রায়ো রুটি
valid_sylhet (152).wav,আর এমনে দরজা খইলে টাউনো ওইরা খাইলে নানে  র টাউনো খুু রেস্টুরেন্টো দশটু খাওয়াবেফার মর মানে বাইরে থাখি যদি খেউ আয় খারে কিতা সাজেস্ট খরতাম বাইরে তাকি বন্ধু খেউ আইলে সবার আগে এখন আসলে ডিজিটাইল অ শোষনোর যুক্ত মানেসবে জানিয়াউ আইযে কিতা খরা উছিত দেখা গেলো যে তুমারে বড়যুট জিগাট যে ফাছ বাইটা কুনানো আর ফানশিটা খুরানতুমইদে প্রিফার খরতায় এই সুযোগ খাউবাই আর যত আমরা যতো খাইতে খাইতে অভ্যুস্ত ওইলে যাইওই বাইরে তাকি খেউ আইলে ডেফিনি তার ফাস্ট যে ফাঁছ বাই বা পানসির মানুষযে
valid_sylhet (153).wav,কুনু এখটা আর সেকেন্ড য় ছলো গিয়া ফম যেখটা খাইছে না দ্বিতীয় বার অখটাত থাইবো এরফরে আর আমরার লোকালি যেতা ফছন্দ খরি দরো খানোর  খনটিননটল ফছন্দ খরি ওখানোর ইন্ডিয়ান ফছন্দ খরি বাইলার মানুষর ই আমি খুব এটা প্রিফার খরি না খেরা বেশিরভাগও আইন ঢাখা তাখি তো তারা আসল ইগুলা আরো ব্যাটার চয়েজ অনেশকাকেউ তাখে ইতারি আমি কিছুটা প্রিফার খররাম সড়কর কিছু রেস্টুরেন্ট আমি প্রিফার খরি এবং বউত সময় আমি বালা রেটিং ফাই বউত সময় খয় যে না ইতা তো আর ছলেও তো ঠিক আছে আসল টা এট আমি স্টো প্রজিক্ট না আবার আমি খুব ইনজয় খরি কুনু গ্যাসট যদি সিলেট আয় তারে সিলেট
valid_sylhet (154).wav,ুস খরা তারে সিলেট খমিইটা খুবতি পারবো না তো সিলেট তো নায় না কাচচি ডাই নাইছে আগে তো সিলেট মরু বাজা কাচ্চিই ফাওয়া যাইতো না এখন কাচ্চ ডাইন আমার বাজান কিতা মনে অয় আছে কাচচে টাইো আরও কিছু আইছে কাচছেকয়ছ  ও মারও যেমন কিতা মনে অয় সিলেটোর কাচচে সিনারিওটা ইম্প্রুভ ওইছে আসলে বন্ধু কুনু ব্রযান্ডোর নামলোয়না লোাটা ইখানা মুভ খর না আইচাআমি দুজি এখটা জানতে ছেতো লাশ খসচিন যেএখটা যে কাচচের সিনারিওটা কু সিলেটোর খআছে আসলে কালচি জিনিসটা খুব বেশিদিন আগে
valid_sylhet (155).wav,র খতা নায় যে কাচ্চি আসলে এটা অফরিচিত খাটি আছিল আমি খইরাম তর আর ফাশশাত বছুর আগের খদ্যে খনো
valid_sylhet (156).wav,আস্তে আসতে আমরা দেখলাম যে শহরোর গ্র্যানড মুয়েডিংগুলার কাচ্চি দেওয়া শুরু খ এটা অনেকের কাছে পরিচিত রগের কাছে অবো কিন্তু যাইু এই জিনিশের আমরা খুব সেলেব্রেট খরা শুরু খরলাম আইচ্ছা ইটাও এখটা ফড়িটা খুব সেলেব্রেট খরি খাওয়া যায় এবং ঢাকার মানুষের মুখেমুখ সবসময় হুলছে টেইি ফুটতা লইয়া ফিযানার জজো তো সিলেট এখন কাচ্চির একচুয়েল ভেঞ্চারগুলা একটা দুইটা আইচে এবং আমার আমার ব্যক্তিগতভাবে আমি জানি যে আরো দুই একটা সবচেয়ে মোস্ট বিলয়েবল ব্রযান্ডগুলাওয়াইচছে তারালেরিসপেসটিসপশ ইছে কি তারাতোর
valid_sylhet (157).wav,আসলে ইকটা বিজনেস যুটা ডিজটলনেশনোর যু এবং ই দুইটা যখন সমন্য য় ওইবো তখন দেশোর ফ্রত্যেকটা অঞ্চলো বড় বড় ব্র্যান্ডগুলা যাইনা বড়ো এবং ছুটো ওয়াট  বার ইটা ম্যাটার খর না এবং আমরা মূলত ঢাকার সংস্কৃতি যেইতা যেটা আগে আমরা ইটা দিকি কিছুটা অইলো বঞজিত আছলাম বা বাংলাদেশোর বাকি তেশোট্টিটা জেলাও যেটা দিকি বঞজিত আছিল এখনই জিনিসটা খবি আইবো ঢাকার সাথে আমাদের যোগাযোগ বাড়বো ঢাকার একটা জিনিস সিলেট আইবো ইটা বাংলাদেশের অন্যান্য জায়গাতো যাইবো গি এবং মুটামুটি ন্যাশনালি কানেক্টেট থাখার যে ব্যাফারটা এই জনি
valid_sylhet (158).wav,টা দ্বিদিন বাড়তেও তাখবো আমি মনো খরিা
valid_sylhet (159).wav,ঢাখাত ন্তু আমার এক্সপেরিেন্স আমি খইমু আমার জায়গা তাকি খুবই বালা আছিল আমার আসলে প্রিফারেন্সও আছিল ফুটটুন তো নতুন ছুট টাই খরা এই জিনিসটারুখু আমি মূলত বেশি জোগ দেছি এবং ফ্তিদিনই প্রায় নতুন নতুন ফুট জো খরছি কিছু কিছু জিনিস আছে যে দেখা গেলো যে যতটুক মনো ওইছে এতোটুক আমার এপিল খরছে না আবার ইটা ওইতো ফারে যে যেহেতু আমি সিলেট তাকি গেছি আমি এতোই বেশি এক্সপেক্ট খরি লিছি যে আসলেই ফমিটা খরা সম্ভব আছিলো না তোসেটা বড় খতা না ঢাকার ম্যে একটা ভাইব আছে ঢাকার মদ্যে একটা দরএকটা বা
valid_sylhet (160).wav,ানিজ্জিক ব্যাপার আছে একটা ট্রেনিংয়ের একটা পরিবেশ আছে মানুষের মদ্যে একটা চঞ্চলতা আছে দৌড়াত্ম আছে ই ব্যাপারগুলা তেকি যদি তুমি কিবাচকতা নিতে ফারো দ্যাট ডেফিনেটলি গুড ফর ইউ আর ইটাও ঠিক এক ধরনের একধরনের ক্লান্তিও আছে আসলে ঢাকা মবে সারাদদের অনেক প্যারাটেরা নিয় অনেক ক্লান্তি চলে আ তো ইফটাও ঠিক আছে অসুবিধা নায় বাট ঢাকাত সব সময় এমন একটা জায়গা একটা যাওয়া আমি সবস প্রিফার খইবো
valid_sylhet (161).wav,াখা দিয়া তো তুই য়ত খাইছো প্রেশোয়র য়নাা খাইছো তারার কিনা রাগলো প্রেশোার াইনোর কন্তু আবা মানে ফ্রেন্ডর নামরিলাতে একটু খয়টা মুশকিল তারফরেও কুনু প্যারা নাই ফাওয়া যায় কিন্তু দরযে প্রেশার অইলো ফুট তো খুবই ভালো তাদের ফুড র কোয়ালিটি খুবই বালায় এবং তারা এমন এমন জিনিসাইন্ট্ুডিউস খরাইছে যে এখটা আসলেও এরা গে ইন্ট্রিডিউস খরাইছে না তো এইটা আমি খবু তারার এখটা ক্লাস কোয়েন যে এমন কিচ্ছু দিতে ফারছি যে এখটা আর খেউ এরাগি দিতে ফারছে না আমার এক্সপেরিয়েন্স গন্তু বালা
valid_sylhet (162).wav,আমি খইতো আমি সবি খরবু যি এখবার ট্রাই খরো সেকেন্ড টাইম হয়তো সবার লাগি প্রিফারে বল লায় যেমন আমি যদি আবার ঢাখা যাই আবার মনো অয় যো আমি খুব এডা প্রিফার খরমু বা আমি যদি এতোটাই ফ্রি না ওইয়া আমি ওতো যাইতাম না কিন্তু জেন্ট আসনি যেটা কুনু বাগ ফরিই লাকি খছু আমি খইবু যে সবর এখবার অইলো ট্রাই খরা উচিত এরফর ওটটা আসলে যার জা ফ্েস বাডোর উফরে আমি ইফটা উকরে আমার কুনু খমবেট নায় ন ইটসে গুরতেগলো ট্রাই ফাস্টাইল লাগি টিক আছে খুব বালা তুই তো বা কাদিন ধরে বাইন চালাই অন র বাইংোর মেইন্টেনেন্স্ট ইফ্রেনেন্স
valid_sylhet (163).wav,এসব ব্যাফারে তোর কস্টো প্রাইজসিডা তরখাা কেমন মডে অয়  কিন্তু খুবই ইন্টাস্টে এটা গোটার খরিলচ আসলে কিন্তু একচেয় বেশি কটেস্টিং ওইলো গিয়া আমি বাইকোর মেনিটিনেন্সের ক্ষেত্রে আসলে খুবই উদাসীন বাইকোর মেডিটেনেন্সে ে আমি খুবই খম খরি যে পরিমাণ বাইকে ডিমানড খরি ফরিমাণ আসলে আমি ফড়ি না ইটা একটা ইটা এখটা বাজে স্ববামি স্বভাবটা এটা ফড়া উচিত না বাট দিকে আছে আমি খইমু ি কেত্রে সলিউশন ওইলো গিয়া ইান শলি ওরু পারমেন্টো সলিউশন তো নাই তুমি মেন্টেনেন্স ডেফিনেটলি ফড়াইতা
