id,sentence
valid_sandwip (1).wav,হড়ালেখা করি খিজীবনেআইছাজীবনের আমনের হরালেখা যদি টার্গেট যদি ানে তুঁই যদি লক্ষ্য স্থির্ন করো তাইলে তু কিয়ান্নে হইরবা
valid_sandwip (2).wav,লৈক্ষ্য আছে নে অনকাল্লানির লক্ষ্য নাই আন্নেরা তো বিয়া দিছেন বা দিদিছেন হ একরকম গেছগে বাঁচি গেছেন আঁই আরগারে লইা আঁই বউত চিন্তা করি বুজ্জেন নার
valid_sandwip (3).wav,বিথের ভিতরে যে বউত ট্যেনশন লাগে আসলে মানে আসলে এই একটা বযাফার ছে আননের এতো অল্ফ বয়সে বিয়োদান যাইতো না আন্ন কি য়ে কম বেশি জীবন সম্পর্কে আরো বালা বুঝঝে আঙগো গি রত তুলনামূলক
valid_sandwip (4).wav,বউত ভালা বুঝে তারফরেও হরগো বারিত জিরু কিচ্ছু বুঝে না আঙগো আত্তে লাইযে বউত কিছু বুঝে ঠিক াছে নে এমনে আঙ্গো ইয়ে তো এন্নেই জিরু কম করু গার ব্যাস করু মাই এক্কানা আত কানা তো দিলে হ্যা হগলে ছ মাস এক্কেরে ইয়া আন্া হ্যা তো আন্নের গুইয়া এক্কানা লরগনিয়া চরিন নিয়া যা হিয়া আন্দা
valid_sandwip (5).wav,আন্জে না আপনার রান দনাছ কাজগিম করাসলেন কাস আমাই রাননে রাকা যাম খবরদা কইয়ের না আই রাইনছিলিয়্যান কইরে ন আইচ্চা রাইন সে সুন করি দায় নইছা তুই হিয়াররে খাইছে কাডা আমকে বরছোইন কেউক েশে মম্মা ভালো অইছে তো একে এগিনকা যে নতুন মাইনছে রাইনছে
valid_sandwip (6).wav,হমার মজো ইসে তো মজা অইসেো এন্নে হেগিন পালা জানে রান্দনের রান্দনের সিস্টেম জানে তো আঙ্গো এরগুন্তো সূৈইন্য কই আমনের কগন তো মু কম আর বেশি জানে আঙগা কিন্তু কিচ্ছু জানে না মুন্নি া রান্দাবাড়িল কপের গ ওগল গোস্ত ব্যাক নাইতে যান
valid_sandwip (7).wav,ও এক্কানা বাড্ডা মাস্টার্সে এগিন এক্কানা কুতটা কুডে নাজে হেগিনে যেক্কানা আইয়া হগিন অবা আমরা কুইততা মারি না হিমু কত্তে কতফু অনেকেনকিলা ডেখছির নাতে তোলা রেখছিননো   কারো নানিনা হরি দেখা ছেমনে সুন্দর
valid_sandwip (8).wav,এন্নে কাম বাড়িক্কানো যে ইয়যান করবিন সুন্দ  যে কাম কর না কাম কি সুনদ আগে তোয়র খাউকি বাড়িক্ানে তো আম কাআমা সম দর  না এমনেই কি ক ক অং কা হিয়ান চিন্তা কইরা আনেকের মন্তু এক্কানা আজগানা করছে দইশারখান আঙগে কিন্তু হিয়ানও নাই
valid_sandwip (9).wav,তো এই আগাইরে কউকাইরা হুনরে এগুনেরে কযেমনে কিরমু আর মানি কোনো চিন্তা কইরলে ওইজনে হরা লেখাও করে না হরা লেখা হড়া লেখার মতো কইললে আরে এক্কারে যে বিয়া শাদী দি তুমু হেরকুম চিন্তা ভাবনাও নাই হরালেখার মতো হরা লেখা করি হরা লেখার মতো হরা লেখা অতাও নাই
valid_sandwip (10).wav,হরালেখার মতো হরা লেখা থাকলে অইন্য গিছুলেই চিন্তা করোর লাগে না হোলাইনের আননে যেগুনের ভিতরে হড়ালেখাটাই খাইল্লা ভিত্তরে থাকে জীবনের লাইন অইতে অইবো হরা লেখা খইত্তে অইবো হেগুন ঝামি লেখাকানা কোনো কিছু আর হিয়াই উগ্গা বুইজ্জেন না আপ তন আরো এক বছর খানিকের বড়
valid_sandwip (11).wav,অবো বিয়ো অনো সরকারি চাকরি করে আংগোো জিেমনিকনা কইন্চে উক্কু আনগখনিএর হোননে মোবাইলে আত্তই দিছো থন মোটি করে ক্কা দিবু একন এক্কেরে এ কই ধনু কই কুকনা রুকনা লম্বা টম্বা দেকিন একইরতো আর্থ অইছে যে কিয়া জানহ
valid_sandwip (12).wav,ফোলার মারা হোলা মাইয়ার মারা আইয়ারা আইয়া করি আক্তা দিয়া লাইছে অন আবার তে আলেতো আনতালি বম জামাই আবে লেখা গইলো গিছে  এরদিন কঅইছে আইতো না অন দেহের না আত্তে অই গেছে গন ইতে আ গলো গেছে তাম পো মাইয়ের সামনে বরিককান জামাইয়া ইরে বাইহি কিা ছরুক্কা অবেন টোলডের্তে হরজল
valid_sandwip (13).wav,মন রে বিয়ের হরে হরন বউত কষ্টের ব্যাফার বুইজ্জেন নে শুধু কষ্ট নো খাইল্লা যে কষ্ট হিয়ান না হিয়ার হরে কতরখমের যে সমস্যা মোকাবেলা করন লাগে কতরখমের কতখ কতা হুনুন লাগে কত কিছু ইয়যওন লাগে
valid_sandwip (14).wav,মুনিয়ার কতা হরিক্কা দিবের কথা আ্গো বিতিননা এগুনে কও আন্নে যাবা কেনাত গানা ধোকাছে আইচ্ছা এক্কারে বুঝিনা হিয়ানো কি ে এই এই জাগা ইয়ানা আঁই ঘুরে আইছি বুজজেন না আঁই জানি এগুন হেতো শক্ত মানুষ নয়
valid_sandwip (15).wav,এগিন ইয়া অইতে অইলে ফড়ালেখারবযফারে বউত বেশি জিত থাকুন লাগে ভিতরে বউত বেশি জিত হুরা দুইনয়াদারি বেগগিন একফাশে থুই হড়ালেখার এক পাশে রাকন লাগে কোনো হড়ালেখা বেশি ঘইত্তো নো এই হরিক্কা কেন্দানের্লাই দুইনিয়া দারি এক কিনারে রাখনের কোনো দরকার নাই
valid_sandwip (16).wav,এক্কারে বযকের কাছে মষকার উিজান লাগে  অতো জীবনে একসময় কামাইয়ে কজীবনে একসময় কামাইয়ে কিন্তু
valid_sandwip (17).wav,আনের ওই যে এ যে সময় আনের ফুরা দুনিয়ার কাছে খারাপ হইযা হিয়ান সহাহ্য করন বউত খষ্ট মনিা গুন হেতো শক্ত মানুষ হেগুনের দাঁড়াইয নাইনো আর এমনে খাইল্লাইমি এট্টি খরি কালা আর কিত্ত কত
valid_sandwip (18).wav,এখন যে এই যোগাই যোগে মেট্টি করি চাল কচতিবানে ব্যাংকের বিয়ে অইয়ালে কেঅরে আর হইত্তে দিতোনো তহন কতো খই মেথ্তি শেষ করি বিয়া দিলে হিয়ার রে ওরেরা আর এই কথা কইতো নো যে আইয় হস কর
valid_sandwip (19).wav,আই হাস করো এ খইতো না তোমরা তাউগে মাংসন মাংস ককি দান্দা কইততাছে আতার মানুষা নানে যে ইসেবে খারাপ ক লিয়া যাওরো টাখে যাতে ছাড়া হড়া লেখাত তো ভালা
valid_sandwip (20).wav,আনের মেধাবী মানি অসম্ভব ম্যাধাবী অসম্ভব মযধাবী আনে খালি হাস কইরলে ধওতো না আঁই তো হইতেত্তে হাস হাশা করি না হ হাইস দিগির মু হাসতো অঙকা ব্যাকে করি েলা হাস তো ব্যাকে করি এলা হেতে হিয়ে রকুম হাস কইরলে অইবোনে
valid_sandwip (21).wav,তে হাস কইর্লে হাসের মতো হাস কইত্তে অইবো এেহন হাস কইর্লে কামাইতো অনুরযায় হা বা না দশজন হাসতেবো য় মহরদ্দ লাইয়েরে বইবিন্দাইও কিনু মদদাে এরে আইজ্জা বিন্দামু কাইলকি আননের  নাকে কানে যে কিন্তু মেয়েগিনা যাইয়ইবো
valid_sandwip (22).wav,হো হই ডুবাইয়াবহেগে কিত্তা বুদরু  রা ্না আকি একজরা বানা দন যনি কিন হুমা ফুনাইচ্ছে রা ছিড়ি বেরে না ও আংটিয়ে হতি ইরা নওজনের আইং টিবুজ্জেন্নে দিছি হাতি দিছি হইলে লাভ দিযে উছে কাঁচা ঘরের মাড়ির ঘরে ফিঁয়া নে বাটির ঘরে থাইকতের কথা
valid_sandwip (23).wav,ওছের ওই আরার লগে আরা দরছে আরা দড়ি লট কি তো যাই তো আর আর হিয়ানের মইদ্দে হেরা খুব গাইছলে হেরাগের লগে দিছে আংকিরে আমি গাই এবের আইটি তো বউত দবছ ন বিদেশি আংকি চিন না আইলে এ ডানরো না বিদেশি আঙকি
valid_sandwip (24).wav,অল আংতি ঠিক বে ওই গেছোবই এই বেত কন এদ্দা বেডির কান্ডো হরা আঁই আন তুই বাজার লইযাই আবার ই বেটারা কিের একগর বিতরে ঢুম তা বাদে ইতো শিইদা করি দিছেনা মিননে জেনব দিন্ডা দি রমযকি কছেড়া বাংাদন
valid_sandwip (25).wav,গাগে মরি আর এইডা উইরে এতা তরি ভিচে  আইগিলে আরেক খত ই দিলে কঅন তো আরে মর্দুব নতুন না খাইলা সামনে দি থাইকলে ও মানে নিচে দি থাইকলে ওইমানে  হয়া আর কি ক মুইনিয়োরোত আকটিকগো ভাইঙ্গি গেছে কিবলে তে হিয়া আর আগের দুগা দি আই ওয়াআন্নে জগা দেকি গেরছি দিছে যা মানে
valid_sandwip (26).wav,আনটে দুবারি কানা মারি কানি তোরা বাঙায় দুদেশ আছ মাপা অইলো অ ক মুনিয়ে মুননের্তে কিবেলা মুনির কানে যাগুন হেগুম সুন্দর লাগে গানা মাইরকি হির কানে যাইবুনা চেব অংকা কানে যাইবুনাছেলিিশেম
valid_sandwip (27).wav,একজরা বানাইদেইন দিবে যেগুন ভালা লাগে হেইতে হেগুন কানে দিবো যে হেগুন ভানো লাগে হেগুন দিবো নাহইলে বানাইয় নালে হেগুন ভালা লাইগলে হেগুন দিবো ন বিশি উইয়ও বাঙ্গালাইতো আরেনটি আরুক্ছে যে কইছে কিমল কইয়া আত্তে সুন্দর লাগে
valid_sandwip (28).wav,তোই সুন্দর লাগে কনে রাখছি ছকেন্নেগে খুগই ভাঙ্গিয়েরে ইয় অই গেছে বে যায়ে যে ভাঙ্গিয়ে লাখছি কেননে কিম বাঙ্গি বনোান যায় ব্যানেন্স দিশি
valid_sandwip (29).wav,াইহনোওইেআয়েদুবা্গাই বাইতে ওই দু িয়ারেলেয়েলো েছেগুলােককাা া বিয়াকিছু লগে লাা আরক্যা আরকরেেু ভাইআনেরি ি বা য় র আই বাঙ্গাই তু যাবা না লাইছি সেগুন বাঙ্গাই তো যাবা নাক বার ভাইয়ের বয়র বিয়ের দিচে  বার চার বিয়রছেরদিবা বিয়ের দি বিয়ের দিবা দরতে দিি
valid_sandwip (30).wav,এক্কারে ভগে তারতিইয়া খাল্লে হিয়ার মথারাই না সমস্তযগি আগে চারির লগে লাগলো চলছি হরে বইছা চিরি দয়েছেো পর জিনিস সুন্দর লাইগতু খান্লা রে বিদেশেত থাঙ্গেি
valid_sandwip (31).wav,বেশিগুন হরে তো মাচ্ছে নাত হইে তোমার ব্যানশল ােলাি কথাা যে লানিন ডাছেআ লাল কইর জিগা যদি আবার জুতাইছো না বিদেশি আস্টায়না আচ্ছে া ব শেকেল য়ে চেেন বোকগার
valid_sandwip (32).wav,ইয়ে স্বন্ডের দাম বাইচ্চের বে বেশি লেশি অ অংকা তো আরও বউত বেশি নআ অঙ্কা বড় অং চেহানব্বই হাজার টিহয়া লাগে না বিরানব্বই হাজার টিয়া হেসঙ্গা আনের বাষট্টি হাজার টিয়া অইছের বেচি লেছি
valid_sandwip (33).wav,আরাতো ছি দিদেশিগিন নব্বই হাজার করি নব্বই হাজার টিয়ে দি ব জুর করি দিছি উন্নানব্বই হাজার তিয়হা নায় নব্বই হাজার টিয়া লালে না তছেআঁই কইলাম আইগা আঁই এননেতোআনব্জর কাসটনরআই এক নাকের গরু দ বান্কে আনাগ যাই আর না আছে কিাননা নব্বই হাজার টিহা কই হাযা হে এবারক পাচশো ডিয়া কম আইকান আাঁচশো ডিয়া না মোটা এক হাজার টেহা কমরাক্ নিছে ত উনানব্বই হাজার তআঙগো রুজিনিরা গানামাগরি বেইচছে কে ম্তা রথাচছে কেছেব
valid_sandwip (34).wav,জুরাগানের মদদি বেচ্ছে কতো ছো আনা একজোড় আইছলো ছো না কররে ন জর  দশতে যারে তিরিশ হাজার টিয়া না বত্রিশ হাজার টিঁয়া বেচ্ছে চো আনা ছয়হানে য়য় সাড়ে ছ আনা বউত কম ন এননে কিনতে গেলো আনা হা ত্রিশ হাজার টিয়া বেশি বলে গিয়া
valid_sandwip (35).wav,বিদেশি সন্ধানের এ মাইচছুর ছে বিহেদুলইতেল প্রচুল জু অন্গো অনকা মিডেল করতে নাই ছেগ আনা মাগি একজরা আছে এগুন আর আকিচাা শে
valid_sandwip (36).wav,বিদেশি হারেক্ষন আছিলো জাগা দছে বিদেশি বরসকা আঁর বোনির্তা এক্কানা  জাগএডিয়েন না যেহেন্ডে হাছ পড়া লইছলের যে হেসমযাবিচছি হই সমকা আ অলম কারি গিরি বি দিছি আরাই বেরি
valid_sandwip (37).wav,দুই বুর গলার খান আর কানা ম্ি চোদা আর আমার বেতনে এর সাথেও ছিলো অঞ্চাশ বাবার হেল দরি তো র ফরে আলগুন দিকরে কুনে কাসছি আর হইলো কিয়ে দিলেছিলেহু
valid_sandwip (38).wav,য়াকিছু করি নো গাছের বাগান দে সযার কি কিনে আট্টুলই নামবার  গাছে অছে বড় বড় গাছ আছেতক হাজার টিহা করা অইছলে আমগা এক লাখ টিহা কর মুলেততো নাগাদা তি হা করি
valid_sandwip (39).wav,অ্যা অনকা মুরি হাককেলল ইটটা বেশি এদিকে হাইলে মনে করছি জুইত মতা খাইলে এদিকে হাইলে চাইর করা হাইলো হেদিক ের্তে বেচি চইলে আইতেম অংকা তো এডিক আসলে জুত মতা হাইয়ো না আর অংকা এদিকে জাগার দাম আরো বউত বেশি হেদিকে যবেত
valid_sandwip (40).wav,লইছিলেম তো কালাইন নিয়া নো োলা হেই সমকা বিটিনের বাপেরে াতো ইয়া নাইতো আসলে আনে এই কাজের মাস্টার জাঙাইয়ান বেইচ্ছা যাই এক লাখ ষাইট হাজার টিহা করা আঁরা হাইজ্জে আগে হইতে জাগা বযয়ে খেত্তে ইয়া কইরবার আগে আঁরে কইরছে ক
valid_sandwip (41).wav,তুই লঅইলা লইয়া অলো বেডারে কচির বেটা আঁরে ফোরে না এত টিঁয়া কোডা হামু অত চ অংকা লন লকে রি গর দিনো তুমি নন লইলা কি তো  লইয়া গেতেতো আংগু পিতিনের বার বেশি ডরাইল্লা কোনো বা আইয়এগের কষেত্তে হাসটিয়া লইবারে ব্যাপারে হেরিয়া
valid_sandwip (42).wav,াকিন্তে বেশি যে আরি রাষ্টিীতি কইত্তো নিয়া যা জানি নাইন সরকারি রেহেট আছে না
valid_sandwip (43).wav,ন স্টি িান তিনি ববেরেসটি ভিও করে না ছতাহইিয়ে কয় দাসিকি করনকিয়িছেআর আর বাপপাা করে রাস্টি কইরাি ে তাহননি কি এস্তে ক্যা কইতি অবি আা বিদিন্না এলা নো বুঝে তো আরেকেম্নিরাস্টিি কইরছে তা ি কানি য় কইর্ছে বছি অহত নয়াত ত ইয়া বিয়ে কচ্ছে না তো অনে নাকিদিক তসটি তোমর না বলে নােরাস্টি ি
valid_sandwip (44).wav,অংকা হে তিয়ে করে না করতা হলে বাইরে তো মলা কিন্তু হইদিহক কবে বিরে ক াতইকা োাতাহনে আর বাইরে ওইয়া পরে ত ইয়ে করি দে স্টে  এই দেসকি কর তা আব্বা আম্মা থাইকাতরে সতিি  আব্বা চইলে ওই লালি যা মিলেইচাো পরে আমরাবেএকেকাত্তর ্ছে গ কার সবসমে বাড়িত্তাছু কলা আর বাইে য়াে া চাের দেচ্ছেছে পারের জাগা চচত কসিকচ্তো লাগছে দিনানােনিশন চিছিনে
valid_sandwip (45).wav,তন দেরােোোোপরে নারি তো বাতেিমানে তোোআতে কাাথাকছিোেেআডেেেনা আ্ডে ব্েড়াতে ছে ে টুে এতে তােআেআাে াতচ্তে েছেনােই পতাদুছি করাইড াাতািিিদাািে হ
valid_sandwip (46).wav,আর য়ান েঝাক্লার উপর দি ঘিরেদিনে যে গযাছলাজিে থাকিরোারারেিাঠিকাার পাড়ি ভািিা কযডাকত টা ভাইয় আরো যা বারে া  ছেত ভাবিবার টাকা দিনি
valid_sandwip (47).wav,ই অবস্থা জালের ক্লাসে ইয়া ইয়ার মতোনায়া আবার বেেশি বায় দছলের কি হিয় আবার বেয়াশি বায়া দিশি ইয়ারে যদি অইন্য গোডা আনি বিয়া দিতো এক সপ্তাহ কোনোভাবে ঠিকার মতো য নাই আঙ্গো ঘরে তো বযাগ খালি মানি চলো মানাই চলো এই কারণে
valid_sandwip (48).wav,চলতেছে তবে আঁই বিরক্ত আঁই একদম বিরক্ত আঁইগারে ফোন করি এগলব যে কত কইনা আর একদম দ্যাকতো লাগে আরে এতো হাকলামি যে নাতে গ্রহণযোগ্য লাগে না গ্রহণ যোগ্য লাগে না গিল্লাই এতো হাকলামিও মানুন জা না আঙ্গো এই বয়সি বিয়া অইছে না এতো অবাস্তব অইলে মানুষ চলে না
